card_id,dashboard_section,question_answered,headline,evidence_file,interpretation,caveat
story_01_global_scale,KPI + trend,How large is the observed displacement stock in the selected scope?,Latest-year stock scope: Refugees+Asylum-seekers+Others of concern,kpi_cards_latest.csv; annual_population_by_type.csv,Use KPI cards and the global time-series to introduce scale before showing origin-destination details.,Totals are observed reported values after redaction/missingness handling.
story_02_top_origin,Graph 5,Which countries produced the largest displaced populations?,Top origin in 2016: Syrian Arab Republic (5.7M),graph5_top_origin_countries.csv,Ranked horizontal bars make the skewed distribution readable.,"This is population stock, not annual applications."
story_03_top_host,Graph 6,Which countries hosted the largest displaced populations?,Top host in 2016: Turkey (3.1M),graph6_top_host_countries.csv,Host-country ranking links the humanitarian story to asylum/residence destinations.,IDPs should not be mixed into host-country rankings unless the dashboard explicitly says active-forced/residence scope.
story_04_flow_network,Sankey / map / network,How are origin and host countries connected?,Top corridors connect the ranked bar charts to spatial and network views.,top_origin_host_corridors.csv; network_metrics_top_corridors.csv,"Use corridors after Graph 5 and Graph 6 so the audience sees relationships, not only rankings.","Stock corridors should be called origin-host population corridors, not literal migration trips."
story_05_advanced_analytics,Forecast / concentration / pressure,What makes the project technically stronger than basic charts?,"Forecasting, concentration metrics, network metrics and optional WDI pressure support the rubric's advanced-analytics criterion.",forecast_model_comparison.csv; origin_host_concentration_by_year.csv; host_pressure_per_100k.csv,These outputs give material for the technical-complexity and ML/analytics discussion.,Forecast is exploratory and WDI pressure is partial unless the denominator file is added.
